{
  "schemaVersie": "0.1",
  "naam": "Counter 5-3-2 (voorbeeld)",
  "opmerking": "Laag blok met vijf achter; balwinst direct diep naar twee spitsen, wingbacks komen laat mee.",
  "team": {
    "tempo": 0.8,
    "pressing_intensiteit": 0.2,
    "pressing_vorm": "zone",
    "lijnhoogte": 0.2,
    "compactheid": 0.85
  },
  "spelers": [
    {
      "id": "GK",
      "rol": "keeper"
    },
    {
      "id": "RWB",
      "rol": "back"
    },
    {
      "id": "RC",
      "rol": "centrale_verdediger"
    },
    {
      "id": "CC",
      "rol": "centrale_verdediger"
    },
    {
      "id": "LC",
      "rol": "centrale_verdediger"
    },
    {
      "id": "LWB",
      "rol": "back"
    },
    {
      "id": "RCM",
      "rol": "box_to_box"
    },
    {
      "id": "LCM",
      "rol": "box_to_box"
    },
    {
      "id": "CMD",
      "rol": "controlerende_middenvelder"
    },
    {
      "id": "RS",
      "rol": "spits"
    },
    {
      "id": "LS",
      "rol": "targetman"
    }
  ],
  "fases": {
    "verdedigen": {
      "blokhoogte": "laag",
      "spelers": [
        {
          "id": "GK",
          "pos": [
            0.03,
            0.5
          ],
          "volg_bal": [
            0.3,
            0.4
          ]
        },
        {
          "id": "RWB",
          "pos": [
            0.17,
            0.93
          ],
          "volg_bal": [
            0.3,
            0.4
          ]
        },
        {
          "id": "RC",
          "pos": [
            0.15,
            0.72
          ],
          "volg_bal": [
            0.3,
            0.4
          ]
        },
        {
          "id": "CC",
          "pos": [
            0.15,
            0.5
          ],
          "volg_bal": [
            0.3,
            0.4
          ],
          "instructies": [
            "dek_ruimte_achter_lijn"
          ]
        },
        {
          "id": "LC",
          "pos": [
            0.15,
            0.28
          ],
          "volg_bal": [
            0.3,
            0.4
          ]
        },
        {
          "id": "LWB",
          "pos": [
            0.17,
            0.07
          ],
          "volg_bal": [
            0.3,
            0.4
          ]
        },
        {
          "id": "RCM",
          "pos": [
            0.25,
            0.66
          ],
          "volg_bal": [
            0.3,
            0.4
          ]
        },
        {
          "id": "LCM",
          "pos": [
            0.25,
            0.34
          ],
          "volg_bal": [
            0.3,
            0.4
          ]
        },
        {
          "id": "CMD",
          "pos": [
            0.22,
            0.5
          ],
          "volg_bal": [
            0.3,
            0.4
          ],
          "instructies": [
            "blijf_achter"
          ]
        },
        {
          "id": "RS",
          "pos": [
            0.32,
            0.6
          ],
          "volg_bal": [
            0.3,
            0.4
          ]
        },
        {
          "id": "LS",
          "pos": [
            0.32,
            0.4
          ],
          "volg_bal": [
            0.3,
            0.4
          ]
        }
      ]
    },
    "opbouw": {
      "spelers": [
        {
          "id": "GK",
          "pos": [
            0.08,
            0.5
          ]
        },
        {
          "id": "RWB",
          "pos": [
            0.27,
            0.93
          ],
          "volg_bal": [
            0.15,
            0.25
          ]
        },
        {
          "id": "RC",
          "pos": [
            0.18,
            0.72
          ],
          "volg_bal": [
            0.15,
            0.25
          ]
        },
        {
          "id": "CC",
          "pos": [
            0.18,
            0.5
          ],
          "volg_bal": [
            0.15,
            0.25
          ]
        },
        {
          "id": "LC",
          "pos": [
            0.18,
            0.28
          ],
          "volg_bal": [
            0.15,
            0.25
          ]
        },
        {
          "id": "LWB",
          "pos": [
            0.27,
            0.07
          ],
          "volg_bal": [
            0.15,
            0.25
          ]
        },
        {
          "id": "RCM",
          "pos": [
            0.31,
            0.66
          ],
          "volg_bal": [
            0.15,
            0.25
          ]
        },
        {
          "id": "LCM",
          "pos": [
            0.31,
            0.34
          ],
          "volg_bal": [
            0.15,
            0.25
          ]
        },
        {
          "id": "CMD",
          "pos": [
            0.28,
            0.5
          ],
          "volg_bal": [
            0.15,
            0.25
          ]
        },
        {
          "id": "RS",
          "pos": [
            0.39,
            0.6
          ],
          "volg_bal": [
            0.15,
            0.25
          ],
          "instructies": [
            "loop_diep"
          ]
        },
        {
          "id": "LS",
          "pos": [
            0.39,
            0.4
          ],
          "volg_bal": [
            0.15,
            0.25
          ],
          "instructies": [
            "vrije_man_zoeken"
          ]
        }
      ]
    },
    "aanval": {
      "spelers": [
        {
          "id": "GK",
          "pos": [
            0.12,
            0.5
          ]
        },
        {
          "id": "RWB",
          "pos": [
            0.72,
            0.93
          ],
          "volg_bal": [
            0.15,
            0.25
          ],
          "instructies": [
            "kom_op"
          ]
        },
        {
          "id": "RC",
          "pos": [
            0.61,
            0.72
          ],
          "volg_bal": [
            0.15,
            0.25
          ]
        },
        {
          "id": "CC",
          "pos": [
            0.61,
            0.5
          ],
          "volg_bal": [
            0.15,
            0.25
          ]
        },
        {
          "id": "LC",
          "pos": [
            0.61,
            0.28
          ],
          "volg_bal": [
            0.15,
            0.25
          ]
        },
        {
          "id": "LWB",
          "pos": [
            0.72,
            0.07
          ],
          "volg_bal": [
            0.15,
            0.25
          ],
          "instructies": [
            "kom_op"
          ]
        },
        {
          "id": "RCM",
          "pos": [
            0.73,
            0.66
          ],
          "volg_bal": [
            0.15,
            0.25
          ]
        },
        {
          "id": "LCM",
          "pos": [
            0.73,
            0.34
          ],
          "volg_bal": [
            0.15,
            0.25
          ]
        },
        {
          "id": "CMD",
          "pos": [
            0.67,
            0.5
          ],
          "volg_bal": [
            0.15,
            0.25
          ]
        },
        {
          "id": "RS",
          "pos": [
            0.82,
            0.6
          ],
          "volg_bal": [
            0.15,
            0.25
          ],
          "instructies": [
            "loop_diep"
          ]
        },
        {
          "id": "LS",
          "pos": [
            0.82,
            0.4
          ],
          "volg_bal": [
            0.15,
            0.25
          ],
          "instructies": [
            "loop_zestien_in"
          ]
        }
      ]
    },
    "balverlies": {
      "gelijk_aan": "verdedigen"
    },
    "balwinst": {
      "gelijk_aan": "opbouw"
    },
    "stilstaand": {
      "gelijk_aan": "verdedigen"
    }
  },
  "triggers": [
    {
      "naam": "Druk als de tegenstander slecht aanneemt",
      "wanneer": {
        "fase": "verdedigen",
        "voorwaarde": "slechte_aanname"
      },
      "dan": [
        {
          "speler": "RS",
          "instructie": "start_pressing"
        }
      ]
    }
  ]
}
